{
  "schema": "spike-lesson/1",
  "title": "Square with a My Block",
  "topic": "Basics",
  "order": 2,
  "summary": "The same square, using your own block called Side.",
  "steps": [
    {
      "title": "Open the starter program",
      "text": "Exactly the same square as before, but the driving and turning live inside a My Block called Side."
    },
    {
      "title": "Why it works",
      "text": "My Blocks let you give a name to a group of blocks and reuse it. The main program reads like a sentence, and if you improve Side, every use of it gets better at once. Good teams build a toolbox of My Blocks."
    },
    {
      "title": "Try it 1",
      "text": "Make a rectangle: use Side 40, Side 20, Side 40, Side 20 without the repeat."
    },
    {
      "title": "Try it 2",
      "text": "Add a second input to Side for the turn amount."
    }
  ],
  "program": "02 Square with a My Block.llsp3",
  "field": "Practice - start box.spk"
}
