{
  "schema": "spike-lesson/1",
  "title": "Turn with the gyro",
  "topic": "Gyro",
  "order": 6,
  "summary": "Turn exactly 90 degrees by watching the yaw angle.",
  "steps": [
    {
      "title": "Open the starter program",
      "text": "The robot turns right 90 degrees four times, using a My Block called TurnRight."
    },
    {
      "title": "Why it works",
      "text": "The hub has a gyro sensor that measures how far the robot has turned (the yaw angle). Turning \"180 wheel degrees\" can be off if a wheel slips, but turning until the gyro says 90 checks the real turn. Turning right makes the yaw go up, turning left makes it go down."
    },
    {
      "title": "Try it 1",
      "text": "Make a TurnLeft block: spin with -20 and 20 and wait until yaw is less than the minus target."
    },
    {
      "title": "Try it 2",
      "text": "Try a faster turn speed. Do you need to stop earlier?"
    },
    {
      "title": "Try it 3",
      "text": "Use TurnRight inside the square program instead of the steering turn."
    },
    {
      "title": "Take the challenge",
      "text": "Start the challenge, then press ▶︎×5. The simulator checks your runs for you."
    }
  ],
  "program": "06 Turn with the gyro.llsp3",
  "field": "Practice - start box.spk",
  "challenge": "exact-90"
}
