{
  "schema": "spike-lesson/1",
  "title": "Drive straight with the gyro",
  "topic": "Gyro",
  "order": 7,
  "summary": "Correct the heading all the way so the robot really drives straight.",
  "steps": [
    {
      "title": "Open the starter program",
      "text": "The robot drives 80 cm, constantly correcting its direction with the gyro."
    },
    {
      "title": "Why it works",
      "text": "Real robots never drive perfectly straight: one wheel is a tiny bit bigger, or slips. The gyro notices the robot pointing off course, and the program steers back. This is another P controller: correction = yaw × 2."
    },
    {
      "title": "Try it 1",
      "text": "Set Realism to Challenging. Run ▶×5 with this program and with a plain move 80 cm block. Compare."
    },
    {
      "title": "Try it 2",
      "text": "Change the gain 2 to 0.5 and to 6. What happens?"
    },
    {
      "title": "Try it 3",
      "text": "Use DriveStraight and TurnRight together to make an accurate square."
    },
    {
      "title": "Try it 4",
      "text": "The gyro keeps the robot pointing the way it started. If it starts crooked, it drives crooked. How could you line the robot up the same way every time?"
    },
    {
      "title": "Take the challenge",
      "text": "Start the challenge, then press ▶︎×5. The simulator checks your runs for you."
    }
  ],
  "program": "07 Drive straight with the gyro.llsp3",
  "field": "Practice - start box.spk",
  "challenge": "gyro-highway"
}
