{
  "schema": "spike-lesson/1",
  "title": "Drive a square",
  "topic": "Basics",
  "order": 1,
  "summary": "Drive 30 cm, turn right, and repeat four times.",
  "steps": [
    {
      "title": "Open the starter program",
      "text": "The robot drives forward 30 cm, spins a quarter turn, and does that four times, so it should end up back where it started."
    },
    {
      "title": "Why it works",
      "text": "A repeat block runs the blocks inside it again and again, so you only write one side of the square. The robot only counts how far its wheels turn. It never checks where it really is. That is called open loop."
    },
    {
      "title": "Try it 1",
      "text": "Change 30 to 50 to make a bigger square."
    },
    {
      "title": "Try it 2",
      "text": "Change repeat 4 to repeat 3 and the turn to 240 degrees. What shape do you get?"
    },
    {
      "title": "Try it 3",
      "text": "Turn Realism to Realistic and press ▶×5. Does the robot end in the same place each time?"
    },
    {
      "title": "Take the challenge",
      "text": "Start the challenge, then press ▶︎×5. The simulator checks your runs for you."
    }
  ],
  "program": "01 Drive a square.llsp3",
  "field": "Practice - start box.spk",
  "challenge": "first-square"
}
